id,url,name,description,num_stars,num_forks,num_issues,num_commits,num_contributors,active_days,last_commit_at,num_functions,used_platforms,used_frameworks,num_packages,num_published_packages,num_faas_handlers,num_faas_runtime_dependencies
242172062,https://github.com/ljacobsson/iam-policies-cli,iam-policies-cli,A CLI tool for building simple to complex IAM policies,68,8,11,33,3,1383,2023-12-05T21:19:47Z,0,,,1,0,0,0
242976504,https://github.com/DEFRA/rod-licensing,rod-licensing,Rod licensing digital services,8,3,1956,1690,13,1538,2024-05-14T14:50:50Z,0,aws,aws_cloudformation_and_sam,11,0,0,0
243027460,https://github.com/Vizzuality/soils-revealed,soils-revealed,"Platform for direct visualization, analysis and reporting of soil organic carbon predictions and changes over time.",8,3,68,493,8,1275,2023-08-23T13:43:24Z,0,,,1,0,0,0
244053675,https://github.com/elestio/cloudgate,cloudgate,Cloudgate is a fast web application server for Node.js,74,10,40,391,7,1288,2023-11-20T16:57:29Z,0,,,2,0,5,0
244216551,https://github.com/BrianRosamilia/azure-function-log-intercept,azure-function-log-intercept,Add console.log support to Azure Functions,26,2,12,26,2,1450,2024-02-19T23:44:06Z,0,,,1,0,0,0
244725805,https://github.com/p1nkun1c0rns/awesomeness,awesomeness,Awesome tools,26,4,499,398,12,1743,2024-03-25T08:18:15Z,0,,,1,0,0,0
245136422,https://github.com/LuXDAmore/nuxt-prune-html,nuxt-prune-html,"🔌⚡ Nuxt module to prune html before sending it to the browser (it removes elements matching CSS selector(s)), useful for boosting performance showing a different HTML for bots/audits by removing all the scripts with dynamic rendering",78,6,57,294,3,1289,2023-09-15T15:02:20Z,0,,,1,0,0,0
245318013,https://github.com/canada-ca/platform-security_securite-de-plateforme,platform-security_securite-de-plateforme,Guidance on Securing Containers and Microservices,15,3,129,137,7,1187,2023-06-06T03:58:54Z,0,,,1,0,0,0
245650798,https://github.com/grandeurdev/js-sdk,js-sdk,Grandeur client for browsers,6,3,79,246,5,1381,2023-12-03T01:52:59Z,0,,,1,0,0,0
245957659,https://github.com/gngsn/pageseo,pageseo,🔥 blog source codes 🔥,11,8,131,112,2,1086,2023-02-28T14:42:09Z,0,,,11,0,1,0
246322368,https://github.com/dayhaysoos/use-shopping-cart,use-shopping-cart,Shopping cart state and logic for Stripe,887,116,339,674,35,1392,2024-01-01T04:14:32Z,0,,,3,0,0,0
246848188,https://github.com/Umkus/lambda-layer-sharp,lambda-layer-sharp,An AWS lambda layer with pre-built sharp node module optimised for minimal layer size,87,26,28,45,3,1309,2023-10-12T07:13:56Z,0,,,1,0,0,0
246936455,https://github.com/option26/quarantine-hero,quarantine-hero,A platform that connects people that need help with those who offer help in their vicinity. The frontend is powered by React with the backend being Firebase.,50,16,475,600,17,1231,2023-07-26T19:59:56Z,0,firebase,firebase,3,0,0,1
247314919,https://github.com/HugoDF/shatstack,shatstack,"Back to basics with the HTML-driven SHATstack: Serverless, HTML, Alpine.js, TailwindCSS",6,1,56,39,3,1027,2023-01-05T19:34:57Z,0,,,1,0,0,0
247606001,https://github.com/netreconlab/parse-hipaa,parse-hipaa,"HIPAA & GDPR compliant ready parse-server with postgres/mongo, parse-hipaa-dashboard. Compatible with ParseCareKit",90,39,98,369,5,1465,2024-03-19T21:20:12Z,0,,,0,0,0,0
248014821,https://github.com/kkomelin/isomorphic-dompurify,isomorphic-dompurify,Use DOMPurify on server and client in the same way,321,14,264,522,7,1518,2024-05-14T02:57:46Z,0,,,1,0,0,0
248286051,https://github.com/Durtur/Dungeoneer,Dungeoneer,"A virtual tabletop designed for 5e D&D, includes a map tool with dynamic lighting, initiative tracker, combat tracker and homebrew management. ",161,15,106,561,5,1336,2023-11-14T12:31:54Z,0,,,2,0,0,0
248697780,https://github.com/philnash/community-sms-broadcast,community-sms-broadcast,"An application that you can use to broadcast SMS messages to people listed on a Google Spreadsheet, powered by Twilio Functions and Twilio Programmable SMS",8,3,18,44,2,1027,2023-01-10T21:11:31Z,0,,,1,0,1,0
248729850,https://github.com/dotnetcore/BootstrapBlazor,BootstrapBlazor,A set of enterprise-class UI components based on Bootstrap and Blazor,1722,251,3392,5683,74,1535,2024-05-15T05:48:03Z,0,,,0,0,0,0
248989238,https://github.com/eheikkenen/rosenthal_online,rosenthal_online,An online Rosenthal model for metal additive manufacturing,5,0,9,57,2,1213,2023-07-17T19:48:36Z,0,,,0,0,0,0
249234386,https://github.com/steveseguin/vdo.ninja,vdo.ninja,VDO.Ninja is a powerful tool that lets you bring remote video feeds into OBS or other studio software via WebRTC.,2533,607,1118,1309,38,1500,2024-04-30T19:06:03Z,0,,,0,0,0,0
249405406,https://github.com/ungdev/discord_bot_firewall,discord_bot_firewall,"Bot discord pour l'enseignement à distance à l'université : amphis virtuels, gestion automatique des rôles et des salons discord, authentification, ...",6,4,550,323,9,1468,2024-03-26T15:44:37Z,0,,,1,0,0,0
249961021,https://github.com/nnthanh101/sentiment-analysis,sentiment-analysis,"Voice of the Customer (VoC) to enhance customer experience with serverless architecture and sentiment analysis, using Amazon Kinesis, Amazon Athena, Amazon QuickSight, Amazon Comprehend, and ChatGPT-LLMs for sentiment analysis.",24,5,71,79,4,1325,2023-11-10T22:18:25Z,0,aws,aws_cloudformation_and_sam,2,0,0,0
250090532,https://github.com/pacslab/ChainFaaS,ChainFaaS,An open blockchain-based Serverless Computing Platform,14,4,27,113,2,1036,2023-02-03T19:49:36Z,0,,,4,0,0,0
250349713,https://github.com/aasisodiya/general,general,Common/Unrelated Stuff,6,2,65,75,2,1372,2023-12-28T19:08:04Z,0,,,0,0,0,0
250480801,https://github.com/vespa-engine/cord-19,cord-19,Search COVID-19 Open Research Dataset (CORD-19) using Vespa - the open source big data serving engine.,34,7,223,524,11,1494,2024-04-26T10:00:30Z,0,,,1,0,0,0
250656741,https://github.com/ptwu/distributed-texasholdem,distributed-texasholdem,"Realtime multiplayer Texas Hold 'Em poker made with socket.io, express, and Node.js",65,43,69,151,3,1237,2023-08-16T16:18:45Z,0,,,1,0,0,0
251020153,https://github.com/scorelab/Codelabz,Codelabz,Codelabz,148,437,1212,1163,51,1378,2024-01-06T07:35:27Z,2,firebase,firebase,2,0,0,1
251061661,https://github.com/c6fc/warcannon,warcannon,High speed/Low cost CommonCrawl RegExp in Node.js,235,37,22,42,-1,1469,2024-04-06T16:27:26Z,0,,,5,0,0,0
252226007,https://github.com/City-Bureau/chi-covid-resources,chi-covid-resources,Find resources in the Chicago area during the coronavirus pandemic,6,3,5,220,3,1062,2023-02-28T01:38:17Z,0,,,1,0,0,0
252657412,https://github.com/hitokoto-osc/hitokoto-api,hitokoto-api,版本：1，现行的 API 运行框架。,425,52,622,1002,12,2119,2023-11-16T11:32:03Z,0,,,1,0,0,0
253202937,https://github.com/chill117/passport-lnurl-auth,passport-lnurl-auth,Passport strategy that uses lnurl-auth,42,11,11,44,-1,1479,2024-04-23T13:07:13Z,0,,,1,0,0,0
253403680,https://github.com/C-Lodder/music-player,music-player,Personal project,5,0,572,988,3,1499,2024-05-14T05:12:01Z,0,,,1,0,0,0
253644261,https://github.com/cloudflare/cloudflare-docs-engine,cloudflare-docs-engine,"A documentation engine built on Gatsby, powering Cloudflare’s docs https://github.com/cloudflare/cloudflare-docs",219,117,367,1092,43,1037,2023-02-07T15:49:08Z,0,,,2,0,0,0
253954640,https://github.com/m3hari/link-preview,link-preview,https://meta.mehari.workers.dev,23,3,16,20,-1,1047,2023-02-19T12:03:32Z,2,cloudflare,wrangler,1,0,0,0
255663209,https://github.com/Eyevinn/lambda-stitch,lambda-stitch,A Lambda function to insert ads in VOD,5,5,16,42,4,1424,2024-03-08T08:12:14Z,0,,,1,0,1,0
256053131,https://github.com/ThatGuySam/vumbnail,vumbnail,All things Vimeo and Thumbnails. Supports Vimeo and Youtube thumbnails. ,38,3,33,569,2,1546,2024-05-08T04:21:13Z,0,vercel,vercel,3,0,0,0
257679769,https://github.com/adobe/asset-compute-sdk,asset-compute-sdk,Adobe Asset Compute Worker SDK,6,8,214,782,14,2355,2024-03-18T16:54:55Z,0,,,1,0,0,0
258034550,https://github.com/josefjadrny/js-chess-engine,js-chess-engine,"Simple JavaScript chess engine without dependencies written in NodeJs. It can be used on both, server or client (web browser) and do not need persistent storage - handy for serverless solutions like AWS Lambda. This engine includes configurable AI computer logic.",122,26,28,257,5,1113,2023-05-10T20:33:50Z,0,,,1,0,0,0
258075566,https://github.com/hackclub/site,site,"🌈 The new, new Hack Club website (uses Next.js & Theme UI).",159,115,1204,2796,108,1490,2024-05-15T18:19:07Z,16,vercel,vercel,1,0,0,0
258295252,https://github.com/chunyenHuang/awesome-g0v-projects,awesome-g0v-projects,令人驚奇的零時政府。找專案，找提案，找共筆，找幫手 一站搞定,28,5,97,157,4,1460,2024-04-22T18:03:35Z,1,aws,serverless,2,0,2,0
258302142,https://github.com/damnitrahul/billy,billy,"A Server less JAM Stack Invoicing Application made with React.js, Redux and Firebase.",26,12,21,45,2,1098,2023-02-22T05:21:55Z,2,firebase,firebase,2,0,0,1
259057159,https://github.com/codfish/vercel-redirects,vercel-redirects,Command-line utility to manage your Vercel project redirects. Doubles as a url shortener.,16,7,9,19,-1,995,2023-01-16T21:06:59Z,0,vercel,vercel,1,0,0,0
259067244,https://github.com/shubhambattoo/shopping-cart,shopping-cart,React Shopping Cart,22,9,173,109,4,1273,2023-10-21T05:47:57Z,0,,,2,0,0,0
259941811,https://github.com/CSSSR/csssr.blog,csssr.blog,New and shiny markdown based CSSSR blog built with Next.js and its static site generation feature.,15,1,791,2112,22,1468,2024-05-06T15:49:44Z,0,,,1,0,0,0
259973478,https://github.com/newrelic/newrelic-azure-functions,newrelic-azure-functions,Functions to collect and forward logs from Microsoft Azure to New Relic Logs,7,13,91,224,16,1476,2024-05-14T13:53:09Z,4,azure,azure_functions;azure_resource_manager,1,0,0,0
260295430,https://github.com/compasjs/compas,compas,Unified backend tooling,9,8,3179,3839,12,1617,2024-05-02T20:09:12Z,0,,,8,0,0,0
260297931,https://github.com/ChromaticHQ/drupalorg-slack,drupalorg-slack,Slack app that queries the Drupal.org API to display your organization's stats.,11,0,120,39,3,1378,2024-02-07T15:49:10Z,0,,,1,0,0,0
261878712,https://github.com/aws-solutions/live-streaming-on-aws-with-amazon-s3,live-streaming-on-aws-with-amazon-s3,"Live streaming on AWS with Amazon S3 automatically configures AWS Elemental MediaLive, Amazon S3 and Amazon CloudFront to ingest, encode, package and deliver a single source live stream through the AWS Cloud. The Solution provides 3 Encoding profiles to support 1080p through 288p HTTP live streaming (HLS) outputs.",108,34,36,71,10,1272,2023-10-30T20:55:16Z,0,,,3,0,1,0
262169735,https://github.com/duartemendes/aws-sam-api-proxy,aws-sam-api-proxy,Like running `sam local start-api` but keeping your containers warm and cozy,17,3,16,94,4,999,2023-01-26T00:00:34Z,0,,,1,0,0,0
262392572,https://github.com/aws-solutions/workload-discovery-on-aws,workload-discovery-on-aws,"Workload Discovery on AWS is a solution to visualize AWS Cloud workloads. With it you can build, customize, and share architecture diagrams of your workloads based on live data from AWS. The solution maintains an inventory of the AWS resources across your accounts and regions, mapping their relationships and displaying them in the user interface.",682,80,505,247,7,1330,2024-05-15T15:36:25Z,0,,,12,0,7,0
262763270,https://github.com/rowanu/boc-updates,boc-updates,"All the AWS updates you need, in one place",7,4,90,70,3,1451,2024-04-30T22:24:30Z,0,,,3,0,4,0
262871055,https://github.com/petersolopov/carbonara,carbonara,API for carbon,121,33,42,95,5,1249,2023-10-12T06:12:25Z,0,,,1,0,0,0
263641327,https://github.com/pmkruyen/dearscholar,dearscholar,"DearScholar: An open-source smartphone app for longitudinal scientific qualitative and quantitative (self-report) diary, log and survey research",9,4,40,566,4,1314,2023-12-18T13:47:57Z,0,,,2,0,0,0
263753576,https://github.com/ljacobsson/cfn-diagram,cfn-diagram,"CLI tool to visualise CloudFormation/SAM/CDK stacks as visjs networks, draw.io or ascii-art diagrams. ",918,70,238,135,9,1437,2024-04-19T10:32:36Z,0,,,1,0,0,0
263814238,https://github.com/nodejs/cjs-module-lexer,cjs-module-lexer,Fast lexer to extract named exports via analysis from CommonJS modules,207,25,98,252,16,1726,2024-04-28T17:46:31Z,0,,,1,0,0,0
264133369,https://github.com/Impact-Office-Supplies/serverless-image-optimizer,serverless-image-optimizer,"Serverless Image Optimizer using AWS S3 + Lambda. Can drop images in, and outputs multiple optimized sizes.",19,0,20,23,-1,1228,2023-09-25T02:34:03Z,1,aws,serverless,1,0,1,0
264196717,https://github.com/digitalocean/openapi,openapi,The OpenAPI v3 specification for DigitalOcean's public API.,92,62,870,480,49,1460,2024-05-14T19:11:14Z,0,,,1,0,0,0
264419569,https://github.com/timofeysie/nextjs-markdown-blog,nextjs-markdown-blog,NextJS Blog using Markdown files,5,2,16,64,-1,1587,2024-05-12T23:32:49Z,0,,,1,0,0,0
264434109,https://github.com/amondnet/vercel-action,vercel-action,This action make a deployment with github actions instead of Vercel builder.,586,95,245,183,31,1668,2024-03-20T00:29:53Z,0,vercel,vercel,1,0,0,0
264982126,https://github.com/ardalis/ardalis-com-gatsby,ardalis-com-gatsby,Back end content for ardalis.com running with Netlify and Gatsby.,12,14,1686,1222,10,1432,2024-04-29T15:10:53Z,1,netlify,netlify,1,0,1,0
266082261,https://github.com/runely/calendar-homey,calendar-homey,Gives Homey flow cards to trigger on your calendar events,12,8,590,1618,11,1410,2024-04-01T08:45:03Z,0,,,1,0,0,0
266192906,https://github.com/stefanfrede/11st-starter-kit,11st-starter-kit,"11ty, powered by Vite with Tailwind CSS and Alpine.js.",373,68,519,238,3,1368,2024-02-19T19:21:04Z,0,netlify,netlify,1,0,0,0
266343367,https://github.com/ahus1/anita-editor,anita-editor,Anita - An Web Editor for AsciiDoc with live preview,14,0,495,460,2,1066,2023-04-26T20:42:14Z,0,netlify,netlify,2,0,8,0
266490168,https://github.com/luxocrates/viciious,viciious,A Commodore 64 emulator in JavaScript,56,4,38,15,-1,1241,2023-10-17T01:57:04Z,0,,,1,0,0,0
266566637,https://github.com/twikoojs/twikoo,twikoo,"💬 一个简洁、安全、免费的静态网站评论系统 | A simple, safe, free comment system.",1265,250,663,320,43,1348,2024-05-15T02:59:09Z,2,vercel,vercel,8,0,2,0
266677657,https://github.com/microfeed/microfeed,microfeed,"a lightweight cms self-hosted on cloudflare, for podcasts, blogs, photos, videos, documents, and curated urls.",3108,804,98,135,6,501,2024-05-10T19:11:46Z,30,cloudflare,wrangler,1,0,0,0
267129470,https://github.com/folio-labs/folio-order-import-tool,folio-order-import-tool,Tool that imports a MARC record to create an order.  This workaround is needed until FOLIO supports importing MARC records to create orders.,5,3,81,263,5,1227,2023-10-06T06:23:18Z,0,,,0,0,0,0
267690483,https://github.com/Pyrax/react-netlify-forms,react-netlify-forms,React components and hooks giving you the power of Netlify Forms. Honeypot fields and reCAPTCHA are included as ready-to-use components.,19,2,65,186,3,1111,2023-06-13T21:13:16Z,0,,,2,0,0,0
268856900,https://github.com/mikesprague/clean-start,clean-start,Open source new tab Chrome extension,10,2,727,1664,3,1430,2024-05-02T21:07:35Z,0,,,1,0,0,0
269458558,https://github.com/AllTheMods/ATM-6,ATM-6,All the Mods 6 - 1.16.5,125,63,3199,1923,41,1329,2024-01-24T14:35:30Z,0,,,0,0,0,0
270426134,https://github.com/abhinaba-ghosh/testcafe-lighthouse,testcafe-lighthouse,:mag: Run Lighthouse performance audit with TestCafe,10,3,141,76,5,1179,2023-08-30T20:12:27Z,0,,,1,0,0,0
270649663,https://github.com/vincentnam/docker_datalake,docker_datalake,Datalake,27,11,121,947,7,1011,2023-03-16T09:08:15Z,0,,,1,0,0,0
270849264,https://github.com/googleapis/google-cloudevents,google-cloudevents,Types for CloudEvents issued by Google,128,20,599,419,22,1411,2024-04-19T16:41:05Z,0,,,4,0,0,0
271521082,https://github.com/panoramicdata/PanoramicData.Blazor,PanoramicData.Blazor,Blazor components,53,4,38,1058,7,1422,2024-05-07T10:54:53Z,0,,,0,0,0,0
271623674,https://github.com/hackclub/scrapbook,scrapbook,🔥 A daily streak system & portfolio for your projects.,156,44,739,957,26,1399,2024-04-09T14:59:36Z,0,vercel,vercel,1,0,0,0
271916888,https://github.com/rschristian/github-contribution-calendar-api,github-contribution-calendar-api,Cloudflare Worker for retrieving data used in GitHub's contribution calendar,18,3,6,98,3,1380,2024-03-24T06:07:46Z,1,cloudflare,wrangler,1,0,0,0
271973616,https://github.com/EnigmaticaModpacks/Enigmatica6,Enigmatica6,The official repository and issue-tracker for Enigmatica 6,240,531,5399,10693,63,1399,2024-05-11T17:01:31Z,0,,,2,0,0,0
271989526,https://github.com/gHashTag/jscamp,jscamp,Школа программирования JS Camp,13,13,155,864,20,1407,2024-04-20T17:32:25Z,0,,,2,0,0,0
272088833,https://github.com/lesimoes/COVID-MG,COVID-MG,A serverless application to save and store covid19 data from Minas Gerais.,5,2,45,53,-1,982,2023-02-20T23:13:53Z,3,aws,serverless,1,0,0,0
272264893,https://github.com/hackclub/scrapbook-domains,scrapbook-domains,Custom domain support for https://scrapbook.hackclub.com/,14,2,16,32,3,1028,2023-04-07T15:57:44Z,1,vercel,vercel,1,0,0,0
272539320,https://github.com/barryf/vibrancy,vibrancy,Headless CMS and Micropub endpoint for personal websites. Used for the back-end of https://barryfrost.com,20,2,59,471,3,1175,2023-09-03T09:43:29Z,13,aws,architect,1,0,13,1
272593070,https://github.com/hackclub/scrappy,scrappy,🗑️ the bot that eats trash (and manages #scrapbook),42,39,597,1616,45,1422,2024-05-03T00:11:38Z,0,,,1,0,0,0
272603869,https://github.com/AndreMor8/gidget,gidget,A Discord bot,69,14,575,1236,15,934,2023-01-06T07:10:29Z,0,,,1,0,0,0
274828089,https://github.com/cloudspannerecosystem/autoscaler,autoscaler,Automatically scale the capacity of your Spanner instances based on their utilization.,83,30,287,220,16,1423,2024-05-03T14:08:28Z,3,gcp,gcp_functions;terraform,1,0,0,1
275473158,https://github.com/jasonlong/json-contributions,json-contributions,Serverless function to get a JSON format of a user's GitHub contribution chart,11,2,7,21,2,961,2023-02-13T15:12:12Z,0,,,1,0,0,0
275533233,https://github.com/rupertbg/aws-load-balancer-logs-to-cloudwatch,aws-load-balancer-logs-to-cloudwatch,Push Load Balancer logs from S3 to CloudWatch Logs,21,10,7,69,3,1052,2023-05-16T11:00:04Z,0,aws,aws_cloudformation_and_sam,1,0,1,0
275944158,https://github.com/HowProgrammingWorks/Exams,Exams,Exams readiness test,107,227,262,53,5,1226,2023-11-07T11:59:24Z,0,,,0,0,0,0
278149885,https://github.com/cloudflare/python-worker-hello-world,python-worker-hello-world,Python hello world for Cloudflare Workers,267,49,25,40,4,980,2023-03-15T22:49:09Z,0,cloudflare,wrangler,1,0,0,0
278335273,https://github.com/anuraghazra/github-readme-stats,github-readme-stats,:zap: Dynamically generated stats for your github readmes,64159,20448,3375,1311,267,1335,2024-03-05T03:27:18Z,0,vercel,vercel,1,0,0,0
278847464,https://github.com/stuysu/api.stuyactivities.org,api.stuyactivities.org,https://api.stuyactivities.org/graphql,9,2,767,1019,14,1365,2024-04-06T09:12:07Z,0,,,1,0,0,0
279388685,https://github.com/nodeshift/nodejs-reference-architecture,nodejs-reference-architecture,The Red Hat and IBM Node.js Reference architecture.  The teams 'opinion' on what components our customers and internal teams should use when building Node.js applications and guidance for how to be successful in production with those components.,1643,120,168,156,24,1287,2024-04-15T20:41:45Z,0,,,2,0,0,0
279502709,https://github.com/kedi/ElectronCord,ElectronCord,An Electron Application that allows you to view & manage many stuff about your Discord bot!,28,3,16,14,-1,1322,2024-02-26T07:45:03Z,0,,,1,0,0,0
280251407,https://github.com/bdsm-tools/bdsm-tools,bdsm-tools,"Source code for the application: BDSM Tools. Provides tools for BDSM enthusiasts, enabling better play and experiences. Raise an issue if you have any ideas for tools. Or make a pull request yourself.",15,4,61,121,2,1255,2023-12-24T00:19:00Z,0,,,3,0,0,0
280412835,https://github.com/saifalfalah/tvdl-2,tvdl-2,🔥 Twitter Video Downloader for Siri Shortcuts - v2,103,6,32,197,2,1112,2023-08-03T13:34:04Z,6,aws,architect,6,0,17,1
281064925,https://github.com/pl4nty/anutimetable,anutimetable,Timetable builder for the Australian National University,22,9,460,2108,27,3198,2024-04-04T00:33:15Z,4,azure,azure_functions,2,0,0,1
282291847,https://github.com/shelcia/CRM-backend,CRM-backend,Backend for CRM,7,1,192,72,3,1164,2023-10-01T06:50:26Z,0,,,1,0,0,0
282802452,https://github.com/stackery/knex-aurora-data-api-mysql,knex-aurora-data-api-mysql,Knex.js driver for AWS Aurora Serverless Data API,9,5,25,76,4,1241,2023-12-20T01:22:27Z,0,,,1,0,0,0
283424228,https://github.com/sarmadgardezi/sarmadgardezi,sarmadgardezi,"Personal website with articles 📚, projects 🎨, and other information about me.",5,0,5,28,-1,928,2023-02-12T11:06:34Z,0,netlify,netlify,0,0,0,0
283536925,https://github.com/workeffortwaste/layout-shift-gif,layout-shift-gif,Visualise the Core Web Vitals metric Cumulative Layout Shift (CLS) with a simple GIF.,146,17,12,48,2,1008,2023-05-03T21:29:04Z,0,,,1,0,0,0
287316954,https://github.com/spotinst/help,help,Spot Documentation.,6,75,4122,6674,68,1301,2024-05-15T20:59:57Z,0,,,1,0,0,0
287506357,https://github.com/probot/pino,pino,🛠️ formatting and error captioning for probot logs,8,11,302,199,6,877,2023-01-08T00:41:07Z,0,,,1,0,0,0
287652377,https://github.com/platelet-app/platelet,platelet,Dispatch system for emergency volunteer couriers.,35,8,197,3201,7,1731,2024-04-16T19:32:12Z,17,aws,aws_cloudformation_and_sam,24,0,47,0
287751270,https://github.com/trustenterprises/hedera-serverless-api,hedera-serverless-api,"Your starting API for building applications with Hedera. Minimise the cost of your SaaS interacting with distributed ledger technology (DLT), Hedera Hashgraph. Deploy your own REST API in 2 minutes, with no cost or additional infrastructure. 🚀",15,10,52,432,2,1354,2024-04-30T17:38:39Z,0,,,1,0,0,0
287877610,https://github.com/wao3/luogu-stats-card,luogu-stats-card,动态生成洛谷个人练习数据卡片,313,19,11,47,-1,945,2023-03-19T07:36:55Z,2,vercel,vercel,4,0,0,0
288208109,https://github.com/logdna/logger-node,logger-node,A nodejs logger client for LogDNA,34,17,82,98,9,1177,2023-11-07T19:49:35Z,0,,,1,0,0,0
288260281,https://github.com/SU-SWS/ood_giving_site,ood_giving_site,Repo for the Giving to Stanford site.,6,1,418,568,17,1369,2024-04-30T20:51:28Z,0,netlify,netlify,1,0,0,0
288847915,https://github.com/awslabs/aws-amplify-identity-broker,aws-amplify-identity-broker,A centralized login and SSO application to authenticate several websites and mobile apps.,197,63,548,1050,10,1345,2024-01-10T00:01:16Z,19,aws,aws_cloudformation_and_sam,15,0,30,0
289060956,https://github.com/netbymatt/ws4kp,ws4kp,WeatherStar 4000+,112,24,43,332,6,1342,2024-05-08T21:42:00Z,0,,,1,0,0,0
289177458,https://github.com/Hazmi35/eslint-config,eslint-config,An ESLint shareable config that I used in my projects,17,0,901,663,2,1326,2024-04-08T16:03:04Z,0,,,1,0,0,0
289323547,https://github.com/blombard/lambda-monorepo,lambda-monorepo,GitHub Action for Deploying AWS Lambda functions in a mono repo,16,4,25,89,3,1298,2024-03-11T13:37:14Z,0,,,1,0,0,0
289765597,https://github.com/gjgd/should-i-play-f6,should-i-play-f6,Chess project to analyze the statistical effect of playing f3 (as white) or f6 (as black) on the outcome of the game.,15,0,15,98,-1,1246,2024-01-21T16:05:37Z,0,aws,serverless,1,0,0,0
289817378,https://github.com/rogerluan/app-store-connect-notifier,app-store-connect-notifier,Node.js app that sends App Store Connect notifications to Slack.,97,23,268,372,6,1288,2024-03-03T20:32:42Z,0,,,1,0,0,0
290587199,https://github.com/Vortexmind/image-resizing,image-resizing,Image resizing Cloudflare worker for Ghost blog image content,29,43,320,558,5,1332,2024-04-19T18:54:17Z,1,cloudflare,wrangler,1,0,0,0
291509535,https://github.com/lechnerc77/myNewsWrap,myNewsWrap,Repo for my video podcast about news from the SAP and Microsoft universe,29,4,9,337,3,1275,2024-02-24T08:53:49Z,0,,,1,0,0,0
292418073,https://github.com/splunk/azure-functions-splunk,azure-functions-splunk,Azure Functions for getting data in to Splunk,28,29,18,85,3,1329,2024-04-23T23:34:06Z,16,azure,azure_functions;azure_resource_manager,3,0,0,0
293888925,https://github.com/timescale/docs,docs,Timescale product documentation 📖,45,85,3183,1930,125,1199,2024-05-15T12:07:18Z,0,,,1,0,0,0
294052679,https://github.com/csuermann/node-red-contrib-virtual-smart-home,node-red-contrib-virtual-smart-home,Node-RED nodes to interact with Amazon Alexa for controlling virtual or physical smart home devices,91,16,253,242,3,1308,2024-04-09T16:09:56Z,0,,,1,0,0,0
296203553,https://github.com/codeforsanjose/project-happening-atm,project-happening-atm,Agenda notifications for local government meetings,14,15,363,1194,27,1248,2024-02-16T23:04:44Z,0,,,5,0,0,0
297582433,https://github.com/appwrite/sdk-for-cli,sdk-for-cli,[READ-ONLY] Official Appwrite CLI >_,82,30,124,143,11,1303,2024-04-17T19:03:54Z,0,,,1,0,0,0
297944153,https://github.com/IBM-Cloud/code-engine-text-analysis,code-engine-text-analysis,"Text Analysis with Code Engine, Cloud Object Storage and Natural Language Understanding",5,10,6,93,4,1273,2023-09-28T18:34:11Z,0,,,3,0,0,0
298120779,https://github.com/emibcn/covid,covid,Progressive Web Application that displays extracted data from the official web https://dadescovid.cat,9,20,509,1020,17,1143,2023-11-10T12:08:41Z,0,,,1,0,0,0
299126397,https://github.com/knopkem/dicomweb-pacs,dicomweb-pacs,Easy to use DICOMWEB enabled PACS with DIMSE services based on sqlite database,84,28,82,150,3,1313,2024-05-03T08:33:21Z,0,,,1,0,0,0
