id,url,name,description,num_stars,num_forks,num_issues,num_commits,num_contributors,active_days,last_commit_at,num_functions,used_platforms,used_frameworks,num_packages,num_published_packages,num_faas_handlers,num_faas_runtime_dependencies
108695,https://github.com/GMOD/jbrowse,jbrowse,"JBrowse 1, a full-featured genome browser built with JavaScript and HTML5. For JBrowse 2, see https://github.com/GMOD/jbrowse-components.",457,197,1625,8129,45,5712,2023-02-06T16:31:12Z,0,,,3,0,0,0
402046,https://github.com/parallax/jsPDF,jsPDF,Client-side JavaScript PDF generation for everyone.,28258,4594,3720,2267,176,5108,2023-04-15T13:44:08Z,0,,,1,0,0,0
436353,https://github.com/stsquad/emacs_chrome,emacs_chrome,"A Chromium/Firefox ""clone"" of It's All Text for spawning an editor to edit text areas in browsers. Based on David Hilley's original Chromium extension.",506,93,187,407,33,5105,2023-12-04T13:19:38Z,0,,,1,0,0,0
478584,https://github.com/jsdom/jsdom,jsdom,"A JavaScript implementation of various web standards, for use with Node.js",19881,1636,3680,3650,290,5117,2024-01-21T13:05:22Z,0,,,2,0,0,0
527644,https://github.com/less/less.js,less.js,Less. The dynamic stylesheet language.,16985,3418,3803,2978,234,5076,2024-01-18T01:26:29Z,0,,,2,0,0,0
597879,https://github.com/Automattic/mongoose,mongoose,MongoDB object modeling designed to work in an asynchronous environment.,26545,3768,14308,21018,402,5153,2024-05-15T11:07:41Z,0,,,2,0,0,0
655209,https://github.com/node-formidable/formidable,formidable,"The most used, flexible, fast and streaming parser for multipart form data. Supports uploading to serverless environments, AWS S3, Azure, GCP or the filesystem. Used in production.",6921,678,941,702,80,4862,2023-08-25T14:21:23Z,0,,,1,0,0,0
680541,https://github.com/xmppo/node-expat,node-expat,libexpat XML SAX parser binding for node.js,384,98,229,313,29,5039,2024-03-08T14:53:18Z,0,,,1,0,0,0
698041,https://github.com/caolan/async,async,Async utilities for node and the browser,28068,2398,1954,1937,235,5065,2024-03-25T21:32:58Z,0,,,1,0,1,0
698944,https://github.com/cyu/rack-cors,rack-cors,"Rack Middleware for handling Cross-Origin Resource Sharing (CORS), which makes cross-origin AJAX possible.",3239,256,274,294,63,5039,2024-03-19T14:55:58Z,0,,,0,0,0,0
701765,https://github.com/GeoNode/geonode,geonode,"GeoNode is an open source platform that facilitates the creation, sharing, and collaborative use of geospatial data.",1372,1101,12200,18891,240,5342,2024-05-15T15:07:16Z,0,,,2,0,0,0
714074,https://github.com/pouchdb/pouchdb,pouchdb,:koala: - PouchDB is a pocket-sized database.,16246,1439,8907,5176,367,5082,2024-05-09T11:38:48Z,0,,,1,0,0,0
718434,https://github.com/slowe/Chromoscope,Chromoscope,Chromoscope lets you explore our Galaxy (the Milky Way) and the distant Universe in a range of wavelengths from X-rays to the longest radio waves.,38,8,56,211,4,4901,2023-11-13T16:06:41Z,0,,,0,0,0,0
732593,https://github.com/cloudera/hue,hue,Open source SQL Query Assistant service for Databases/Warehouses,1073,350,3637,20914,231,5072,2024-05-15T04:58:32Z,0,,,7,0,65,0
747698,https://github.com/sinonjs/sinon,sinon,"Test spies, stubs and mocks for JavaScript.",9541,764,2596,3633,328,5161,2024-05-15T12:09:16Z,0,,,2,0,0,0
790359,https://github.com/sequelize/sequelize,sequelize,"Feature-rich ORM for modern Node.js and TypeScript, it supports PostgreSQL (with JSON and JSONB support), MySQL, MariaDB, SQLite, MS SQL Server, Snowflake, Oracle DB (v6), DB2 and DB2 for IBM i.",28987,4239,16742,10926,376,5017,2024-04-16T14:13:30Z,0,,,13,0,0,0
797129,https://github.com/node-apn/node-apn,node-apn,:calling: Apple Push Notification module for Node.js,4369,677,728,1108,62,4816,2023-10-02T00:21:46Z,0,,,1,0,0,0
907262,https://github.com/jazzband/django-tinymce,django-tinymce,TinyMCE integration for Django,1236,317,467,523,56,5730,2024-04-29T22:15:28Z,0,,,0,0,0,0
915160,https://github.com/onilabs/stratifiedjs,stratifiedjs,Oni StratifiedJS (previously Apollo),231,22,20,2441,7,4989,2024-05-14T00:52:45Z,0,,,1,0,0,0
931039,https://github.com/browserify/browserify,browserify,browser-side require() the node.js way,14513,1184,2057,2291,169,4777,2023-10-21T07:13:09Z,0,,,1,0,0,0
948957,https://github.com/Automattic/node-canvas,node-canvas,Node canvas is a Cairo backed Canvas implementation for NodeJS.,9860,1129,2367,1922,155,4946,2024-04-14T05:31:47Z,0,,,1,0,0,0
991475,https://github.com/brianc/node-postgres,node-postgres,PostgreSQL client for node.js.,11851,1181,3204,2687,280,4973,2024-05-10T17:03:11Z,0,,,8,0,0,0
1130565,https://github.com/node-config/node-config,node-config,Node.js Application Configuration,6188,482,747,701,93,4874,2024-01-31T17:37:13Z,0,,,1,0,0,0
1206546,https://github.com/winstonjs/winston,winston,A logger for just about everything.,21937,1789,2460,1577,351,4882,2024-05-09T16:22:49Z,0,,,1,0,0,0
1213225,https://github.com/highlightjs/highlight.js,highlight.js,JavaScript syntax highlighter with language auto-detection and zero dependencies.,22967,3497,4006,6614,419,6460,2024-04-26T23:41:04Z,0,,,1,0,0,0
1254497,https://github.com/codemirror/codemirror5,codemirror5,"In-browser code editor (version 5, legacy)",26533,4950,7064,7165,414,4850,2024-04-22T19:46:40Z,0,,,1,0,0,0
1336019,https://github.com/mapbox/tilelive,tilelive,fast interface to tiles with pluggable backends - NOT ACTIVELY MAINTAINED,524,105,229,913,26,4915,2024-04-25T19:46:51Z,0,,,1,0,0,0
1338813,https://github.com/paperjs/paper.js,paper.js,"The Swiss Army Knife of Vector Graphics Scripting – Scriptographer ported to JavaScript and the browser, using HTML5 Canvas. Created by @lehni & @puckey",14181,1203,2067,7404,74,4717,2024-01-07T14:15:24Z,0,,,3,0,0,0
1464595,https://github.com/OpenNebula/one,one,The open source Cloud & Edge Computing Platform bringing real freedom to your Enterprise Cloud 🚀,1142,461,6563,20791,142,5810,2024-05-14T12:27:29Z,0,,,2,0,0,0
1584707,https://github.com/vpulim/node-soap,node-soap,A SOAP client and server for node.js.,2962,1476,831,1026,274,4785,2024-05-14T06:45:12Z,0,,,1,0,0,0
1585384,https://github.com/kristopolous/db.js,db.js,Thin portable Javascript document store event-driven database,40,6,10,500,-1,4569,2023-10-11T00:18:34Z,0,,,1,0,0,0
1599151,https://github.com/alphagov/static,static,GOV.UK static files and resources,18,10,3311,10695,194,4783,2024-05-15T13:04:01Z,0,,,1,0,0,0
1602811,https://github.com/fluent-ffmpeg/node-fluent-ffmpeg,node-fluent-ffmpeg,A fluent API to FFMPEG (http://www.ffmpeg.org),7435,857,1269,761,83,4599,2023-11-13T21:58:56Z,0,,,1,0,1,0
1739767,https://github.com/mozilla/rhino,rhino,Rhino is an open-source implementation of JavaScript written entirely in Java,3944,816,1393,4233,92,9146,2024-05-04T03:59:51Z,0,,,0,0,0,0
1991863,https://github.com/zotero/translators,translators,Zotero Translators,1111,728,3302,6008,219,5725,2024-05-15T15:10:26Z,0,,,2,0,0,0
2055965,https://github.com/swagger-api/swagger-ui,swagger-ui,"Swagger UI is a collection of HTML, JavaScript, and CSS assets that dynamically generate beautiful documentation from a Swagger-compliant API.",25430,8804,9555,6490,393,4678,2024-05-15T14:14:23Z,0,,,2,0,0,0
2156920,https://github.com/ldapjs/node-ldapjs,node-ldapjs,LDAP Client and Server API for node.js,1546,392,979,820,67,4667,2024-05-14T22:10:45Z,0,,,1,0,0,0
2158019,https://github.com/geoip-lite/node-geoip,node-geoip,"Native NodeJS implementation of MaxMind's GeoIP API -- works in node 0.6.3 and above, ask me about other versions",2276,350,264,264,48,4578,2024-02-15T17:34:30Z,0,,,1,0,0,0
2171254,https://github.com/biwascheme/biwascheme,biwascheme,Scheme interpreter written in JavaScript,722,129,336,1342,37,5655,2024-04-26T08:50:36Z,0,,,1,0,0,0
2536587,https://github.com/Automattic/juice,juice,Juice inlines CSS stylesheets into your HTML source.,3042,216,477,615,66,4442,2023-12-06T06:54:27Z,0,,,1,0,0,0
2631864,https://github.com/onigoetz/Comics-Reader,Comics-Reader,Read your comic book scans on tablet !,33,4,255,408,5,4494,2024-02-11T20:54:06Z,0,,,1,0,0,0
2765899,https://github.com/openpgpjs/openpgpjs,openpgpjs,OpenPGP implementation for JavaScript,5552,786,1552,2313,104,4481,2024-02-19T16:23:54Z,0,,,2,0,0,0
2828239,https://github.com/Jermolene/TiddlyWiki5,TiddlyWiki5,"A self-contained JavaScript wiki for the browser, Node.js, AWS Lambda etc.",7687,1145,7627,11920,246,4558,2024-05-15T11:25:02Z,0,,,1,0,10,0
2871998,https://github.com/debug-js/debug,debug,A tiny JavaScript debugging utility modelled after Node.js core's debugging technique. Works in Node.js and web browsers,10977,898,945,536,103,4205,2023-06-04T11:10:21Z,0,,,1,0,0,0
2967233,https://github.com/DataDog/documentation,documentation,The source for Datadog's documentation site.,408,968,23181,58799,333,4538,2024-05-15T15:13:37Z,0,aws,aws_cloudformation_and_sam,1,0,0,0
3019537,https://github.com/linuxmint/cinnamon,cinnamon,"A Linux desktop featuring a traditional layout, built from modern technology and introducing brand new innovative features. ",4358,718,12015,8649,290,4540,2024-05-15T17:21:36Z,0,,,0,0,0,0
3028364,https://github.com/OpenDSA/OpenDSA,OpenDSA,Working source for the OpenDSA eTextbook project,301,128,591,13520,122,4508,2024-04-24T13:36:31Z,0,,,2,0,0,0
3102131,https://github.com/Heigvd/Wegas,Wegas,A Web Game Authoring System coded in Java and Javascript for rapid development of serious games without programming skills.,28,15,1948,13839,19,4503,2024-05-03T11:49:06Z,0,,,6,0,0,0
3390543,https://github.com/jasondavies/d3-cloud,d3-cloud,Create word clouds in JavaScript.,3763,1075,188,44,4,4414,2024-03-10T21:31:50Z,0,,,1,0,0,0
3476812,https://github.com/eugef/node-mocks-http,node-mocks-http,Mock 'http' objects for testing Express routing functions,739,128,301,503,73,4454,2024-04-29T17:02:11Z,0,,,1,0,0,0
3536442,https://github.com/notepadqq/notepadqq,notepadqq,"A simple, general-purpose editor for Linux",2069,298,1090,1439,56,4110,2023-05-27T10:12:17Z,0,,,4,0,0,0
3957383,https://github.com/mihaifm/linq,linq,linq.js - LINQ for JavaScript,1625,224,110,125,16,4212,2023-10-19T16:49:44Z,0,,,1,0,0,0
4007018,https://github.com/Katello/katello,katello,Katello integrates open source systems management tools into a single solution for controlling the lifecycle of your machines.,370,282,10691,20625,155,4718,2024-05-15T17:24:44Z,0,,,3,0,0,0
4054838,https://github.com/zot/Leisure,Leisure,"Polyglot, document-based computing environment.  Leisure is very much in flux, right now; please check the readme, below.  For a taste of the new version, click the link below, but be warned that it only works in Chrome.",114,8,84,2013,6,4284,2023-02-07T17:42:12Z,0,,,4,0,0,0
4117355,https://github.com/mongo-express/mongo-express,mongo-express,"Web-based MongoDB admin interface, written with Node.js and express",5326,927,1518,1726,125,4397,2024-05-07T15:38:17Z,0,,,1,0,0,0
4254338,https://github.com/graphite-project/graphite-web,graphite-web,A highly scalable real-time graphing system,5829,1255,2830,4328,311,5682,2023-11-15T22:26:18Z,0,,,0,0,0,0
4268140,https://github.com/moment/moment-timezone,moment-timezone,Timezone support for moment.js,3786,830,1102,649,48,4288,2024-02-04T06:36:16Z,0,,,1,0,0,0
4473517,https://github.com/Countly/countly-server,countly-server,"Countly is a product analytics platform that helps teams track, analyze and act-on their user actions and behaviour on mobile, web and desktop applications.",5441,952,5209,20706,77,4370,2024-05-15T08:17:47Z,0,,,45,0,0,0
4475810,https://github.com/jshttp/cookie,cookie,HTTP server cookie parsing and serialization,1263,139,160,324,26,4353,2024-04-29T11:10:15Z,0,,,1,0,0,0
4890177,https://github.com/sitespeedio/sitespeed.io,sitespeed.io,"sitespeed.io is an open-source tool for comprehensive web performance analysis, enabling you to test, monitor, and optimize your website’s speed using real browsers in various environments.",4616,584,4099,9084,108,4331,2024-05-13T21:21:34Z,0,,,1,0,0,0
4909355,https://github.com/CartoDB/cartodb,cartodb,Location Intelligence & Data Visualization tool,2717,655,16441,77987,126,4629,2023-09-15T10:33:45Z,0,,,1,0,0,0
5022564,https://github.com/jsdelivr/jsdelivr,jsdelivr,"A free, fast, and reliable Open Source CDN for npm, GitHub, Javascript, and ESM",5339,2029,18541,81,10,2391,2023-11-23T15:08:35Z,0,,,0,0,0,0
5245894,https://github.com/ractivejs/ractive,ractive,Next-generation DOM manipulation,5935,401,3422,5741,61,4243,2024-03-14T00:27:08Z,0,,,2,0,0,0
5569059,https://github.com/mishoo/UglifyJS,UglifyJS," JavaScript parser / mangler / compressor / beautifier toolkit",12913,1234,5809,3322,115,3886,2023-01-16T13:30:59Z,0,,,1,0,0,0
5677202,https://github.com/deliciousbrains/wp-amazon-s3-and-cloudfront,wp-amazon-s3-and-cloudfront,Automatically copies media uploads to Amazon S3 for delivery. Optionally configure Amazon CloudFront for even faster delivery.,300,144,642,462,12,4179,2024-02-13T11:16:14Z,0,,,0,0,0,0
5694513,https://github.com/aws/aws-sdk-js,aws-sdk-js,AWS SDK for JavaScript in the browser and Node.js,7544,1549,4410,5910,187,4269,2024-05-14T18:25:15Z,0,,,1,0,0,0
5839692,https://github.com/webpack/webpack-dev-server,webpack-dev-server,Serves a webpack app. Updates the browser on changes. Documentation https://webpack.js.org/configuration/dev-server/.,7730,1426,5096,2628,264,4250,2024-05-07T12:55:15Z,0,,,1,0,0,0
6135596,https://github.com/archiverjs/node-archiver,node-archiver,a streaming interface for archive generation,2722,231,762,905,35,4170,2024-03-10T03:14:34Z,0,netlify,netlify,2,0,0,0
6175370,https://github.com/thsmi/sieve,sieve,Sieve Script Editor,717,56,909,2166,18,6459,2024-01-06T13:25:08Z,0,,,1,0,0,0
6498492,https://github.com/airbnb/javascript,javascript,JavaScript Style Guide,140995,26078,2877,1974,406,4175,2024-04-07T18:18:29Z,0,,,3,0,0,0
6698407,https://github.com/brownplt/pyret-lang,pyret-lang,The Pyret language.,1048,105,1719,6799,44,4193,2024-05-09T03:57:16Z,0,,,1,0,0,0
6720403,https://github.com/simple-icons/simple-icons,simple-icons,SVG icons for popular brands,17872,2446,10848,6648,430,4185,2024-05-02T22:51:07Z,0,,,2,0,0,0
6734135,https://github.com/ekohe/wulin_master,wulin_master,Wulin Master fight for enterprise problem,20,7,56,3218,10,4632,2024-04-09T06:54:13Z,0,,,0,0,0,0
6898387,https://github.com/apache/cordova-ios,cordova-ios,Apache Cordova iOS,2141,981,1411,3969,182,5746,2024-04-27T14:28:22Z,0,,,1,0,0,0
6954731,https://github.com/lzqwebsoft/heroku-blog,heroku-blog,使用Maven管理的轻巧型个人博客，基于Spring MVC与Hibernate，可用于部署在Heroku上。,8,6,6,514,-1,4168,2024-04-30T01:59:46Z,0,,,0,0,0,0
7045549,https://github.com/ENCODE-DCC/encoded,encoded,Metadata database for ENCODE project,109,53,4421,17300,47,4120,2024-03-15T16:57:32Z,0,,,2,0,0,0
7136784,https://github.com/rollbar/rollbar.js,rollbar.js,Error tracking and logging from Javascript to Rollbar,563,212,1136,1963,97,4115,2024-03-19T14:15:21Z,0,,,1,0,0,0
7323216,https://github.com/mhart/aws4,aws4,Signs and prepares Node.js requests using AWS Signature Version 4,676,172,163,145,9,4137,2024-04-23T12:05:09Z,0,,,2,0,0,0
7363211,https://github.com/knex/knex,knex,"A query builder for PostgreSQL, MySQL, CockroachDB, SQL Server, SQLite3 and Oracle, designed to be flexible, portable, and fun to use.",18640,2076,6071,3075,434,4154,2024-05-14T13:12:31Z,0,,,1,0,0,0
7431305,https://github.com/newrelic/node-newrelic,node-newrelic,"New Relic Node.js agent code base. Developers are welcome to create pull requests here, please see our contributing guidelines. For New Relic technical support, please go to http://support.newrelic.com.",955,380,2179,10010,112,4480,2024-05-14T15:57:46Z,0,,,1,0,0,0
7436098,https://github.com/igrep/igreque.info,igreque.info,My website,10,0,26,908,2,4120,2024-04-16T00:44:51Z,0,,,0,0,0,0
7876204,https://github.com/emberjs/ember-inspector,ember-inspector," Adds an Ember tab to the browser's Developer Tools that allows you to inspect Ember objects in your application.",975,297,2570,2415,121,4116,2024-05-06T13:11:58Z,0,,,2,0,0,0
7886579,https://github.com/olleicua/hcl,hcl,Hot Cocoa Lisp,34,4,33,141,2,3794,2023-06-05T05:36:16Z,0,,,1,0,0,0
7910045,https://github.com/badges/shields,shields,"Concise, consistent, and legible badges in SVG and raster format",22307,5426,9972,7277,442,3778,2024-05-07T18:23:18Z,0,,,4,0,0,0
7994556,https://github.com/vega/vega,vega,A visualization grammar.,10822,1467,3887,6435,135,4114,2024-05-10T22:44:39Z,0,,,35,0,0,0
8456659,https://github.com/SUSE/hackweek,hackweek,SUSE Hack Week tools and data,64,53,1522,2535,26,4094,2024-05-14T09:22:26Z,0,,,0,0,0,0
8507859,https://github.com/protobufjs/protobuf.js,protobuf.js,Protocol Buffers for JavaScript (& TypeScript).,9604,1372,1987,830,106,2722,2024-05-10T03:34:08Z,0,,,12,0,0,0
8576730,https://github.com/pa11y/pa11y,pa11y,Pa11y is your automated accessibility testing pal,3942,246,700,573,49,3242,2024-03-26T19:53:10Z,0,,,1,0,0,0
8629417,https://github.com/mapbox/mapbox-gl-js,mapbox-gl-js,"Interactive, thoroughly customizable maps in the browser, powered by vector tiles and WebGL",10673,2160,13088,11279,337,3975,2024-05-15T08:29:54Z,0,,,3,0,0,0
8635901,https://github.com/ternjs/tern,tern,"A JavaScript code analyzer for deep, cross-editor language support",4243,379,1054,1339,93,3900,2023-09-15T22:19:26Z,0,,,1,0,0,0
8815876,https://github.com/jmoenig/Snap,Snap,a visual programming language inspired by Scratch,1460,731,3357,7368,95,4071,2024-05-08T15:23:29Z,0,,,1,0,0,0
8842243,https://github.com/jishi/node-sonos-http-api,node-sonos-http-api,"An HTTP API bridge for Sonos easing automation. Hostable on any node.js capable device, like a raspberry pi or similar.",1807,462,890,537,61,3959,2024-01-18T11:09:53Z,0,,,1,0,0,0
8987608,https://github.com/florianholzapfel/express-restify-mongoose,express-restify-mongoose,Easily restify mongoose databases,640,154,463,911,47,4061,2024-05-06T13:59:35Z,0,,,1,0,0,0
9230316,https://github.com/scimusmn/stele,stele,Kiosk application for museum media exhibits,26,4,61,976,46,4008,2024-03-25T15:48:45Z,0,,,1,0,0,0
9385519,https://github.com/fantasyland/fantasy-land,fantasy-land,Specification for interoperability of common algebraic structures in JavaScript,9980,372,337,304,53,3911,2023-12-26T21:42:11Z,0,,,1,0,0,0
9489902,https://github.com/sidorares/node-mysql2,node-mysql2,:zap: fast mysqljs/mysql compatible mysql driver for node.js,3894,587,2577,2942,198,4038,2024-05-06T21:08:51Z,0,,,2,0,0,0
9645494,https://github.com/popeindustries/inline-source,inline-source,"Tool for inlining flagged js, css, and img sources in html",190,46,314,450,20,3859,2023-11-17T15:00:37Z,0,,,1,0,0,0
9709563,https://github.com/summernote/summernote,summernote,Super simple WYSIWYG editor,11343,2232,4630,3651,303,4000,2024-04-09T09:55:24Z,0,,,1,0,0,0
9739352,https://github.com/atsepkov/RapydScript,RapydScript,"Python-inspired, decluttered JavaScript",684,67,253,755,11,3741,2023-07-26T22:33:26Z,0,,,1,0,0,0
9933602,https://github.com/mbraak/django-file-form,django-file-form,Django-file-form helps you to write forms with a pretty ajax upload,149,37,863,1384,22,4019,2024-04-27T09:46:29Z,0,,,2,0,0,0
10064545,https://github.com/systemjs/systemjs,systemjs,Dynamic ES module loader,12834,1087,2476,2250,114,4016,2024-05-13T04:30:58Z,0,,,2,0,0,0
10140982,https://github.com/SitecorePowerShell/Console,Console,Sitecore PowerShell Extensions,115,71,1325,2675,22,4014,2024-05-15T00:08:43Z,0,,,0,0,0,0
10308334,https://github.com/mscdex/busboy,busboy,A streaming parser for HTML form data for node.js,2760,211,358,201,14,3701,2023-07-15T15:08:15Z,0,,,1,0,0,0
10433767,https://github.com/yegor256/dynamo-archive,dynamo-archive,"Archive and Restore DynamoDB Tables, from the Command Line",101,32,51,127,13,3854,2023-12-21T10:58:59Z,0,,,1,0,0,0
10546179,https://github.com/B3Partners/tailormap,tailormap,B3partners Tailormap (legacy) repository,29,38,2711,8607,16,4473,2024-01-25T12:58:22Z,0,,,1,0,0,0
10555401,https://github.com/giggio/node-chromedriver,node-chromedriver,An installer and wrapper for Chromedriver.,469,178,458,429,79,3993,2024-05-14T01:26:59Z,0,,,1,0,0,0
10572563,https://github.com/metarhia/impress,impress,Enterprise application server for Node.js and Metarhia private cloud ⚡,958,125,1923,2346,36,3975,2024-04-26T22:27:59Z,0,,,1,0,0,0
10851820,https://github.com/ramda/ramda,ramda,:ram: Practical functional Javascript,23535,1433,3400,3016,303,3979,2024-05-14T06:10:45Z,0,,,1,0,0,0
10888192,https://github.com/d3/d3-geo-projection,d3-geo-projection,Extended geographic projections for d3-geo.,1071,201,221,463,13,3638,2023-06-09T13:35:03Z,0,,,1,0,0,0
10999165,https://github.com/OptimalBits/bull,bull,Premium Queue package for handling distributed jobs and messages in NodeJS.,14976,1430,2547,2174,209,3975,2024-05-15T05:14:55Z,0,,,1,0,0,0
11195700,https://github.com/KaTeX/KaTeX,KaTeX,Fast math typesetting for the web.,17626,1139,3689,2147,151,3962,2024-05-10T18:27:52Z,0,,,6,0,0,0
11205780,https://github.com/motdotla/dotenv,dotenv,Loads environment variables from .env for nodejs projects.,18396,826,800,719,76,3960,2024-05-08T20:01:49Z,0,,,1,0,0,0
11308080,https://github.com/gamedig/node-gamedig,node-gamedig,Query game servers and not only! Node.JS/Deno or Bash (via the CLI).,568,140,561,653,42,3958,2024-05-11T16:36:07Z,0,,,1,0,0,0
11309292,https://github.com/yazz/yazz,yazz,Self Service Apps Without the IT Department,530,47,70,13155,5,3960,2024-05-10T11:29:46Z,0,,,2,0,0,0
11551538,https://github.com/koajs/koa,koa,Expressive middleware for node.js using ES2017 async functions,34783,3222,1752,1195,214,3901,2024-04-22T06:25:10Z,0,,,1,0,0,0
11667865,https://github.com/reactjs/react-rails,react-rails,"Integrate React.js with Rails views and controllers, the asset pipeline, or webpacker.",6714,760,1324,1495,148,3943,2024-05-12T02:11:59Z,0,,,2,0,0,0
12028300,https://github.com/tediousjs/node-mssql,node-mssql,Microsoft SQL Server client for Node.js,2205,458,1641,1244,84,3903,2024-04-18T10:59:08Z,0,,,1,0,0,0
12558645,https://github.com/violentmonkey/violentmonkey,violentmonkey,Violentmonkey provides userscripts support for browsers. It works on browsers with WebExtensions support.,5048,421,1983,3211,64,3906,2024-05-14T14:33:18Z,0,,,1,0,0,0
12973222,https://github.com/depcheck/depcheck,depcheck,Check your npm module for unused dependencies,4514,218,876,1264,92,3766,2024-01-12T14:24:38Z,0,,,1,0,0,0
13112745,https://github.com/prerender/prerender,prerender,Node server that uses Headless Chrome to render a javascript-rendered page as HTML. To be used in conjunction with prerender middleware.,6361,914,785,720,61,3875,2024-05-06T11:30:08Z,0,,,1,0,0,0
13142168,https://github.com/prerender/prerender-node,prerender-node,Express middleware for prerendering javascript-rendered pages on the fly for SEO,915,191,243,308,42,3798,2024-02-20T12:42:54Z,0,,,1,0,0,0
13395052,https://github.com/mholt/PapaParse,PapaParse,Fast and powerful CSV (delimited text) parser that gracefully handles large files and malformed input,12072,1131,1050,503,121,3824,2024-03-27T16:29:21Z,0,,,1,0,0,0
13509707,https://github.com/concord-consortium/codap,codap,CODAP (Common Online Data Analysis Platform),87,37,1259,8242,24,3869,2024-05-15T16:08:53Z,0,,,3,0,0,0
13584262,https://github.com/webtorrent/webtorrent,webtorrent,⚡️ Streaming torrent client for the web,28851,2669,2691,3555,163,3842,2024-04-22T12:25:34Z,0,,,1,0,0,0
13911118,https://github.com/angular-fullstack/generator-angular-fullstack,generator-angular-fullstack,Yeoman generator for an Angular app with an Express server,6130,1244,2803,2787,141,3816,2023-02-14T04:42:54Z,0,,,1,0,0,0
13964315,https://github.com/brianc/node-pg-copy-streams,node-pg-copy-streams,"COPY FROM / COPY TO for node-postgres.  Stream from one database to another, and stuff.",325,44,154,242,14,3549,2023-07-17T10:46:10Z,0,,,1,0,0,0
14284411,https://github.com/padloc/padloc,padloc,"A modern, open source password manager for individuals and teams.",2523,228,713,3417,29,3682,2023-12-10T09:16:06Z,0,,,11,0,0,0
14397208,https://github.com/JetBrains/kotlin-web-site,kotlin-web-site,The Kotlin programming language website,1411,3641,4157,8419,405,3835,2024-05-15T09:30:08Z,0,,,1,0,0,0
14571443,https://github.com/up-for-grabs/up-for-grabs.net,up-for-grabs.net,"This is a list of projects which have curated tasks specifically for new contributors. These issues are a great way to get started with a project, or to help share the load of working on open source projects. Jump in!",5171,1983,4512,5378,436,3829,2024-05-15T14:22:41Z,0,,,1,0,0,0
14812631,https://github.com/mapbox/node-pre-gyp,node-pre-gyp,Node.js tool for easy binary deployment of C++ addons,1098,254,715,1224,63,3514,2023-07-14T13:01:19Z,0,,,2,0,0,0
15246993,https://github.com/shepherd-pro/shepherd,shepherd,Guide your users through a tour of your app,11813,604,2776,2765,99,3801,2024-05-14T00:57:56Z,0,,,7,0,0,0
15573486,https://github.com/wzrdsappr/trading-core,trading-core,Backend core needed for automated trading,73,39,6,15,2,3620,2023-12-01T04:05:28Z,0,,,0,0,0,0
15696040,https://github.com/ibmdb/node-ibm_db,node-ibm_db,IBM DB2 and IBM Informix bindings for node,185,154,996,1071,43,4877,2024-04-15T09:45:43Z,0,,,1,0,0,0
15728293,https://github.com/sandstorm-io/sandstorm,sandstorm,Sandstorm is a self-hostable web productivity suite. It's implemented as a security-hardened web app package manager.,6626,701,3697,8194,102,3694,2024-02-18T21:00:39Z,0,,,3,0,0,0
15900151,https://github.com/patriksimek/vm2,vm2,Advanced vm/sandbox for Node.js,3817,278,532,467,32,3464,2023-07-10T22:41:05Z,0,,,1,0,0,0
16147933,https://github.com/tc39/test262,test262,Official ECMAScript Conformance Test Suite,2178,440,4063,6478,194,4961,2024-05-13T22:35:23Z,0,,,1,0,0,0
16195791,https://github.com/dondi/GRNsight,GRNsight,Web app and service for modeling and visualizing gene regulatory networks.,16,8,1114,3226,27,3742,2024-04-23T09:43:08Z,0,,,1,0,0,0
16602433,https://github.com/1j01/jspaint,jspaint,"🎨 Classic MS Paint, ＲＥＶＩＶＥＤ + ✨Extras",7081,552,338,2607,12,3746,2024-05-11T00:30:29Z,0,,,3,0,0,0
