id,url,name,description,num_stars,num_forks,num_issues,num_commits,num_contributors,active_days,last_commit_at,num_functions,used_platforms,used_frameworks,num_packages,num_published_packages,num_faas_handlers,num_faas_runtime_dependencies
108386308,https://github.com/greenbone/gsa,gsa,Greenbone Security Assistant - The web frontend for the Greenbone Community Edition,198,88,4017,22726,37,5342,2024-05-08T13:15:32Z,0,,,1,0,0,0
108696044,https://github.com/rkoeninger/ShenScript,ShenScript,Shen for JavaScript,54,4,43,899,2,2338,2024-03-24T03:56:20Z,0,,,1,0,0,0
108708339,https://github.com/sudheerj/javascript-interview-questions,javascript-interview-questions,List of 1000 JavaScript Interview Questions,21454,6150,253,618,98,2155,2024-05-14T02:08:37Z,0,,,0,0,0,0
108839908,https://github.com/cloudconformity/auto-remediate,auto-remediate,Cloud Conformity Auto Remediate,152,57,141,458,25,2289,2024-02-05T03:47:30Z,48,aws,serverless,1,0,39,0
109264409,https://github.com/CityOfDetroit/ddot-info,ddot-info,Find schedules and real-time data for DDOT buses,8,4,149,677,5,2338,2024-04-16T13:35:05Z,4,netlify,netlify,1,0,4,0
109566938,https://github.com/goodrain/rainbond-console,rainbond-console,"Rainbond, Production-Grade Serverless PaaS",59,75,1414,6881,33,2295,2024-03-12T07:58:43Z,0,,,2,0,0,0
109852497,https://github.com/jiacai2050/mofish,mofish,摸鱼，我们是认真的,53,6,656,82,2,2343,2024-04-07T14:03:32Z,0,,,1,0,0,0
110032930,https://github.com/bpetetot/conference-hall,conference-hall,📣  An open SaaS platform to manage call for papers,131,46,998,517,26,2048,2023-06-18T13:32:14Z,15,firebase,firebase,3,0,0,1
110061103,https://github.com/blackflux/lambda-rate-limiter,lambda-rate-limiter,Light memory rate-limiter for Lambda,55,4,1270,2159,8,2095,2023-08-05T02:06:57Z,0,,,1,0,0,0
110152936,https://github.com/aws/aws-ops-wheel,aws-ops-wheel,The AWS Ops Wheel is a randomizer that biases for options that haven’t come up recently; you can also outright cheat and specify the next result to be generated.,322,68,124,93,20,2281,2024-02-07T22:57:06Z,0,aws,aws_cloudformation_and_sam,1,0,0,0
110178895,https://github.com/brave/brave-browser,brave-browser,"Brave browser for Android, iOS, Linux, macOS, Windows.",16506,2105,37983,8263,92,2744,2024-05-15T16:15:53Z,0,,,1,0,0,0
110233754,https://github.com/alertlogic/cwe-collector,cwe-collector,AWS CloudWatch Events Collector,12,16,89,166,10,2272,2024-01-30T07:44:10Z,0,,,1,0,1,0
110303079,https://github.com/Jey-Cee/ioBroker.deconz,ioBroker.deconz,"Connects to deConz software developed by dresden-elektronik. This software aims to be a universal ZigBee Gateway solution, using hardware from dresden-elektronik the ConBee USB stick and RaspBee a modul for the Raspberry Pi.",54,35,370,675,37,3580,2024-05-10T19:46:14Z,0,,,1,0,0,0
110349686,https://github.com/Glifery/cors-proxy,cors-proxy,Simple AWS Lambda based proxy server for making CORS requests from browser to any HTTP server,48,30,35,14,5,2081,2023-07-24T20:02:51Z,1,aws,serverless,1,0,0,1
110477417,https://github.com/blackflux/js-gardener,js-gardener,"Minimizes package setup and maintenance complexity, so you can focus on writing code.",7,6,1716,3057,11,2188,2023-11-10T00:12:05Z,0,,,1,0,0,0
110575325,https://github.com/netlify/netlify-lambda,netlify-lambda,Helps building and serving lambda functions locally and in CI environments,596,125,643,666,60,1920,2023-02-15T15:16:09Z,0,,,1,0,1,0
110643155,https://github.com/Coteh/simpleimage,simpleimage,:sunrise_over_mountains: A simple image hosting service implemented using Node.js + Express + MongoDB + Redis,9,5,793,590,11,2225,2024-01-20T17:59:34Z,0,,,1,0,0,0
111050153,https://github.com/mozilla/ensemble-transposer,ensemble-transposer,A Node task which reformats and adds metadata to raw data :musical_score: :pen:,10,8,235,492,15,2372,2024-05-15T18:59:11Z,0,,,1,0,0,0
111320697,https://github.com/blackflux/s3-cached,s3-cached,S3 File Access Abstraction providing Memory and Disk Caching Layer,21,7,2313,3979,8,2084,2023-08-05T05:03:00Z,0,,,1,0,0,0
111349117,https://github.com/blackflux/lambda-monitor,lambda-monitor,Lambda log monitoring and streaming to external services.,14,8,2777,5020,11,2084,2023-08-05T05:06:10Z,0,,,1,0,0,0
111374840,https://github.com/OpenMined/openmined-website,openmined-website,The OpenMined website...,43,16,168,400,11,2354,2024-05-01T03:14:08Z,0,,,1,0,0,0
112068436,https://github.com/lirantal/bazz,bazz,🚀📩 effortless remote push notifications for the CLI,5,1,25,28,3,2292,2024-04-07T07:28:25Z,0,,,1,0,0,0
112372302,https://github.com/internet4000/find,find,URL & local first client side actions for the browser omnibox,33,3,103,369,5,2369,2024-05-07T08:53:49Z,0,,,1,0,0,0
113041050,https://github.com/archerysec/archerysec,archerysec,Automate Your Application Security Orchestration And Correlation (ASOC) Using ArcherySec.,2189,495,647,1431,19,2247,2024-01-29T11:32:43Z,0,,,0,0,0,0
113221178,https://github.com/NYPL/firehose-avro-to-json-transformer,firehose-avro-to-json-transformer,Transform records from a Kinesis Firehose stream from Avro encoded JSON to JSON.,5,0,9,41,3,1925,2023-03-15T17:59:08Z,2,aws,aws_cloudformation_and_sam;terraform,1,0,0,0
113339570,https://github.com/Baqend/react-speed-analyzer,react-speed-analyzer,The Page Speed Analyzer gives you an impression of how Baqend Speed Kit influences the performance of your website,9,7,108,1002,10,2341,2024-05-06T14:38:43Z,0,,,2,0,0,0
113416018,https://github.com/scheduleonce/aws-ses-to-elasticsearch,aws-ses-to-elasticsearch,AWS Lambda function that sends SES notifications to Elasticsearch,6,5,11,10,3,2115,2023-10-06T10:41:22Z,0,,,1,0,1,0
113489929,https://github.com/matthewturner/alexa-salus-it500,alexa-salus-it500,Alexa Skill to control Salus IT500 Thermostat,10,4,45,107,2,2429,2023-09-05T18:55:29Z,1,aws,aws_cloudformation_and_sam,1,0,3,0
113743358,https://github.com/nearst/laconia,laconia,"Create well-crafted serverless applications, effortlessly.",318,30,939,2227,17,2314,2024-04-11T07:29:27Z,0,,,11,0,0,0
114327057,https://github.com/daviddeejjames/send-that-invoice,send-that-invoice,A small node app that automatically emails a file from a given Dropbox folder :outbox_tray: (now on AWS),11,1,43,87,2,2293,2024-03-26T13:33:17Z,0,,,2,0,0,0
114362984,https://github.com/nicolasdao/aws-cloudwatch-logger,aws-cloudwatch-logger,Promise based logger for AWS CloudWatch LogStream,19,17,12,32,5,2212,2024-01-05T07:22:19Z,0,,,1,0,0,0
114726946,https://github.com/PacktPublishing/Hands-On-Chatbots-and-Conversational-UI-Development,Hands-On-Chatbots-and-Conversational-UI-Development,"Hands-On Chatbots and Conversational UI Development, published by Packt",24,26,5,15,3,1868,2023-01-30T10:23:23Z,0,,,7,0,0,0
115215687,https://github.com/jpdillingham/SWoT,SWoT,"A web application for designing, tracking, and reporting progress on workouts. Written in JavaScript with React, Redux, Material UI, and hosted by a serverless AWS backend.",15,2,315,1735,2,1912,2023-03-19T16:35:03Z,0,,,2,0,1,0
115228080,https://github.com/Kikobeats/untracked,untracked,Universal way for ignoring unnecessary common files to fit your bundle,29,2,46,169,6,2327,2024-05-08T08:28:33Z,0,,,1,0,0,0
115839107,https://github.com/IntriguingTiles/hgrunt-bot,hgrunt-bot,a discord bot,8,2,26,309,4,1981,2023-06-04T05:55:08Z,0,,,1,0,0,0
115898553,https://github.com/evanchiu/serverless-galleria,serverless-galleria,Serverless batch photo manipulation and publishing,173,82,77,62,2,2137,2023-11-08T05:12:28Z,8,aws,aws_cloudformation_and_sam,10,0,0,0
116014572,https://github.com/sigalor/whatsapp-web-reveng,whatsapp-web-reveng,Reverse engineering WhatsApp Web.,6001,798,342,183,31,2302,2024-04-22T11:38:56Z,0,,,2,0,0,0
116923306,https://github.com/mouWorks/pepeBot_LambdaAPI,pepeBot_LambdaAPI,AWS LambdaAPI for Pepe,6,0,12,623,7,2211,2024-01-30T01:44:59Z,0,,,1,0,3,0
117132991,https://github.com/internetarchive/internet-archive-voice-apps,internet-archive-voice-apps,"Voice Apps (Actions on Google, Alexa Skill) of Internet Archive. Just say: ""Ok Google, Ask Internet Archive to Play Jazz"" or ""Alexa, Ask Internet Internet Archive to play Instrumental Music""",45,45,595,1607,10,2213,2024-02-06T15:38:42Z,3,firebase,firebase,5,0,1,1
117412650,https://github.com/frankfaustino/code-challenges,code-challenges,My collection of completed code challenges,8,4,20,501,2,2259,2024-03-22T00:06:33Z,0,,,1,0,0,0
117463191,https://github.com/BlueWallet/BlueWallet,BlueWallet,Bitcoin wallet for iOS & Android. Built with React Native ,2429,749,6390,9458,93,2313,2024-05-15T10:31:14Z,0,,,4,0,0,0
117572226,https://github.com/dschep/bikehero,bikehero,🚲🔧 A webapp for crowd-sourced Fixit-stands & bike pumps,8,2,684,273,4,1819,2023-01-08T21:25:53Z,3,aws,serverless,1,0,0,0
117877090,https://github.com/DataDog/dd-trace-js,dd-trace-js,JavaScript APM Tracer,588,284,4271,2519,150,2310,2024-05-15T11:13:31Z,0,,,3,0,0,0
118159195,https://github.com/duo-labs/cloudmapper,cloudmapper," CloudMapper helps you analyze your Amazon Web Services (AWS) environments.",5809,790,958,968,87,2141,2023-11-30T22:26:56Z,0,,,1,0,0,0
118301322,https://github.com/honeycombio/beeline-nodejs,beeline-nodejs,Legacy instrumentation for node.js applications with Honeycomb,53,58,728,501,44,2278,2024-04-26T16:07:59Z,0,,,1,0,0,0
119272562,https://github.com/streetlives/streetlives-api,streetlives-api,The Streetlives backend providing the API for accessing data,5,1,102,167,6,2299,2024-05-15T04:02:08Z,1,aws,aws_cloudformation_and_sam,1,0,1,0
119617199,https://github.com/lspiehler/node-openssl-cert,node-openssl-cert,Node.JS OpenSSL wrapper,25,8,10,254,2,1921,2023-05-06T00:06:16Z,0,,,1,0,0,0
119972831,https://github.com/zotoio/launchdarkly-nodeutils,launchdarkly-nodeutils,Node functions wrapping LaunchDarkly API and exposed as a commandline tool.,9,4,123,147,7,1813,2023-01-20T07:41:07Z,0,,,1,0,0,0
120518359,https://github.com/jsetton/alexa-aftership,alexa-aftership,Unofficial Alexa Skill for AfterShip Shipment Tracking Platform,7,1,34,27,-1,2162,2024-01-08T19:56:22Z,2,aws,alexa_skills_kit;aws_cloudformation_and_sam,1,0,1,0
120951690,https://github.com/bcgov/range-web,range-web,The Range Mobile Pathfinder project is developing a suite of applications to support the sustainable management of cattle range on crown lands in British Columbia.,9,11,1115,2792,19,2287,2024-05-15T17:14:52Z,0,,,4,0,0,0
121425707,https://github.com/ys/bonjour,bonjour,🌊,5,3,371,1892,4,550,2024-05-15T06:02:57Z,2,vercel,vercel,1,0,0,0
121919614,https://github.com/ejarzo/Shape-Your-Music,Shape-Your-Music," A web application for drawing music.",132,22,172,334,4,2220,2024-03-18T14:43:39Z,0,netlify,netlify,1,0,4,0
122397092,https://github.com/Apollon77/ioBroker.mbus,ioBroker.mbus,Communicate with mbus devices,11,9,364,323,15,2235,2024-04-05T10:21:35Z,0,,,1,0,0,0
122609275,https://github.com/sahilnarain/aws-api-gateway-log-parser,aws-api-gateway-log-parser,AWS API Gateway Log Parser,16,2,20,48,3,2168,2024-01-31T06:29:31Z,0,,,1,0,0,0
122653051,https://github.com/jcubic/lips,lips,Scheme based powerful lisp interpreter in JavaScript,381,30,361,2527,10,2271,2024-05-13T21:02:34Z,0,,,1,0,0,0
122903394,https://github.com/CFBD/cfb-api,cfb-api,College football API - Programming interface for accessing the college football database,45,9,292,527,6,2145,2024-01-10T17:08:23Z,0,,,1,0,0,0
123457981,https://github.com/openaddresses/deploy,deploy,Cloudformation Deploy Tool for OpenAddresses,9,4,56,415,6,2254,2024-05-01T20:26:21Z,0,,,1,0,0,0
123623280,https://github.com/appium/appium-safari-driver,appium-safari-driver,Safari browser support for Appium,21,10,118,140,6,2234,2024-04-10T06:38:43Z,0,,,1,0,0,0
124080249,https://github.com/jelastic-jps/kubernetes,kubernetes,Kubernetes Clusters - Managed and Unmanaged Cloud Hosting,16,31,52,315,9,2115,2024-02-08T10:25:44Z,0,,,0,0,0,0
124994291,https://github.com/nessgor/telegraf-session-dynamodb,telegraf-session-dynamodb,DynamoDB session middleware for Telegraf,8,4,8,32,2,2048,2023-10-20T22:19:49Z,0,aws,serverless,1,0,0,0
125179157,https://github.com/hendrysadrak/firestore-store,firestore-store,express-session store for Firebase Cloud Firestore,47,2,128,158,4,1763,2023-01-10T12:57:43Z,0,,,1,0,0,0
125312859,https://github.com/jgriepentrog/cfn-custom-resource,cfn-custom-resource,Node.js module providing utility functions for AWS Cloudformation Custom Resources,10,2,81,151,4,2079,2023-11-23T04:37:11Z,0,,,1,0,0,0
125576685,https://github.com/blackflux/yaml-boost,yaml-boost,Yaml Parser with various additions.,24,4,1214,1936,9,1969,2023-08-07T00:03:12Z,0,,,1,0,0,0
126847086,https://github.com/Rookout/docs,docs,Rookout Documentation,7,14,694,2218,47,2218,2024-04-21T12:42:01Z,0,firebase,firebase,1,0,0,0
126882913,https://github.com/Stradivario/gapi,gapi,Inspired by Angular intended to provide complex Nodejs Graphql Backend applications with minimum effort.,25,2,97,1653,-1,2141,2024-02-04T15:46:42Z,0,,,21,0,0,0
127193762,https://github.com/Cimpress-MCP/Platform-Authorizer,Platform-Authorizer,It Authorizes… on the Platform™!,5,2,42,117,-1,2086,2023-08-29T12:00:53Z,1,aws,aws_cloudformation_and_sam,1,0,0,0
127441354,https://github.com/Stremio/stremio-addon-sdk,stremio-addon-sdk,🧙 A Node.js SDK for creating and publishing Stremio add-ons,556,147,264,682,15,2218,2024-04-20T18:51:06Z,0,,,1,0,0,0
127836080,https://github.com/probot/adapter-aws-lambda-serverless,adapter-aws-lambda-serverless,An extension for running Probot on Lambda,94,37,125,126,21,2004,2023-09-18T19:18:07Z,0,,,1,0,0,0
128388750,https://github.com/ioio-creative/ioio-website-wordpress-react,ioio-website-wordpress-react,"IOIO Creative official website built using WordPress as back-end, and React for front-end.",5,0,57,843,4,2013,2023-10-10T04:11:02Z,0,,,5,0,0,0
128636610,https://github.com/Koenkk/zigbee2mqtt,zigbee2mqtt,"Zigbee 🐝 to MQTT bridge 🌉, get rid of your proprietary Zigbee bridges 🔨",10979,1576,17266,5457,400,2420,2024-05-13T20:35:26Z,0,,,1,0,0,0
128687182,https://github.com/nishinoshake/aws-rough,aws-rough,ざっくりAWS,256,13,67,580,2,2040,2023-11-09T02:01:14Z,0,,,1,0,0,0
128868345,https://github.com/saidsef/tika-document-to-text,tika-document-to-text,Apache Tika - Toolkit detects and extracts metadata,5,3,246,545,3,2220,2024-05-11T14:11:56Z,0,,,1,0,0,0
129539644,https://github.com/majorbyte/rebbl,rebbl,website for handling rebbl results,19,13,906,1336,11,2219,2024-05-11T09:29:18Z,0,,,1,0,0,0
129591116,https://github.com/GC-spigot/AdvancedEnchantments,AdvancedEnchantments,Superior Custom Enchantments Creator for Minecraft And Spigot platform,132,60,4285,173,9,2198,2024-04-20T21:40:16Z,0,,,0,0,0,0
129631886,https://github.com/aneagoie/smart-brain-boost-lambda,smart-brain-boost-lambda,lambda in our final project for ranking badge system,19,16,18,8,-1,1963,2023-08-30T16:41:27Z,0,,,1,0,0,0
129710921,https://github.com/zooniverse/front-end-monorepo,front-end-monorepo,A rebuild of the front-end for zooniverse.org,101,31,6049,4289,25,3520,2024-05-15T12:31:19Z,0,,,12,0,0,0
129845562,https://github.com/pinballmap/pbm-react,pbm-react,PBM React Native: iOS & Android Apps,29,8,550,1986,8,2221,2024-05-15T19:38:41Z,0,,,1,0,0,0
129922398,https://github.com/styled-icons/styled-icons,styled-icons,"💅 Popular icon packs like Font Awesome, Material Design, and Octicons, available as React Styled Components",2078,62,2133,2572,19,2180,2024-04-05T15:42:10Z,0,,,41,0,0,0
129963130,https://github.com/FabricLabs/idlerpg,idlerpg,"Generalized implementation of IdleRPG, a game which rewards participants for remaining idle.",6,4,10,71,3,1801,2023-03-23T19:14:24Z,0,,,1,0,0,0
130268258,https://github.com/living-room/turing,turing,:octopus: programmable space at Recurse Center,52,7,48,312,8,2193,2024-01-23T22:38:08Z,0,,,1,0,0,0
131072921,https://github.com/npm/rfcs,rfcs,Public change requests/proposals & ideation,714,233,556,266,41,2200,2024-05-03T18:48:22Z,0,,,1,0,0,0
131184049,https://github.com/leopardslab/nodecloud,nodecloud,:zap: The Node.js API for open cloud,93,89,189,323,17,1954,2023-09-02T07:05:29Z,0,,,9,0,0,0
131506479,https://github.com/sallar/github-contributions-chart,github-contributions-chart,:octocat: Generate an image of all your Github contributions,5106,230,148,190,31,2184,2024-04-21T19:45:56Z,0,,,1,0,0,0
131642969,https://github.com/serverless/utils,utils,General serverless utilities,29,21,222,500,12,1968,2023-09-19T19:10:02Z,0,,,1,0,0,0
131855907,https://github.com/vimtaai/gumdrop,gumdrop,Script to display Markdown documents as static HTML pages,10,2,22,131,-1,2050,2023-12-12T20:39:56Z,0,,,1,0,0,0
131876799,https://github.com/Bannerets/tdl,tdl,Node.js bindings to TDLib 🥒,345,45,153,531,5,2261,2024-04-19T20:33:41Z,0,,,4,0,0,0
131886178,https://github.com/DanielMuller/geoip-serverless,geoip-serverless,Serverless GeoIP API,13,2,37,115,2,2044,2023-12-05T13:12:51Z,0,aws,serverless,1,0,9,0
131912342,https://github.com/aws-cloudformation/cfn-lint-visual-studio-code,cfn-lint-visual-studio-code,"CloudFormation Linter IDE integration, autocompletion, and documentation",246,128,393,364,8,2184,2024-04-24T19:06:02Z,0,,,3,0,0,0
132057151,https://github.com/Alheimsins/bigfive-web,bigfive-web,Website for taking personality tests,200,83,502,965,15,2178,2024-04-19T15:44:14Z,0,,,1,0,0,0
133889523,https://github.com/OSU-Sustainability-Office/energy-dashboard,energy-dashboard,Oregon State University's energy dashboard.,11,0,328,922,8,2188,2024-05-13T18:52:35Z,45,aws,aws_cloudformation_and_sam,4,0,0,0
133942427,https://github.com/llangit/lambda-mongocluster-s3,lambda-mongocluster-s3,Backup MongoDB cluster database to AWS S3 via a Lambda function.,54,32,16,22,5,1901,2023-08-01T12:44:42Z,0,,,1,0,1,0
133954704,https://github.com/f2e-awesome/knowledge,knowledge,文档着重构建一个完整的「前端技术架构图谱」，方便 F2E(Front End Engineering又称FEE、F2E) 学习与进阶。,1876,369,13,247,6,1751,2023-02-28T13:49:58Z,0,,,1,0,0,0
134004426,https://github.com/xwingtmg/xwing-data2,xwing-data2,An easy-to-use collection of data and images from X-Wing: The Miniatures Game (Second Edition) by Fantasy Flight Games.,96,69,684,1890,37,2129,2024-03-17T05:09:10Z,0,,,1,0,0,0
134322242,https://github.com/CityOfPhiladelphia/phila.gov-router,phila.gov-router,Lambda@Edge function for handling redirects and rewrites for phila.gov,6,2,1385,2437,12,2210,2024-05-08T18:33:14Z,0,,,1,0,0,0
134992035,https://github.com/wei/pull,pull,🤖 Keep your forks up-to-date via automated PRs,5669,613,530,399,11,2137,2024-04-04T03:40:40Z,0,,,1,0,0,0
135286803,https://github.com/logzio/logz-docs,logz-docs,Logz.io user documentation,16,46,2496,2392,53,1991,2023-11-15T12:11:41Z,0,netlify,netlify,1,0,0,0
135363077,https://github.com/Nike-Inc/lambda-zipper,lambda-zipper,Zip up your node lambda code and production dependencies without pruning node_modules,9,4,11,29,2,2099,2024-02-28T01:30:55Z,0,,,1,0,0,0
135757304,https://github.com/lifeomic/lambda-tools,lambda-tools,Common utilities for Lambda testing and development,23,7,359,825,26,2155,2024-04-25T09:00:46Z,0,,,1,0,0,0
136450996,https://github.com/wdr-data/code4maus,code4maus,Grafische Programmierumgebung. Zum spielerischen Erlernen von Programmierkonzepten. Basiert auf Scratch vom MIT,114,9,115,3738,54,2626,2023-11-24T14:37:01Z,3,aws;netlify,aws_cloudformation_and_sam;netlify;serverless,1,0,3,0
136576554,https://github.com/KSH-code/awesome-practical-posts,awesome-practical-posts,I sum up the articles of tech blogs and share that.,65,7,12,264,-1,2119,2024-03-27T02:17:51Z,0,,,0,0,0,0
136774924,https://github.com/blackflux/object-scan,object-scan,Traverse object hierarchies using matching and callbacks.,157,16,1801,3547,9,1945,2023-10-06T18:06:25Z,0,,,1,0,0,0
136916998,https://github.com/zotero/translation-server,translation-server,A Node.js-based server to run Zotero translators,114,42,167,229,10,2150,2024-04-12T09:48:15Z,0,,,1,0,1,0
136923993,https://github.com/backyourstack/backyourstack,backyourstack,BackYourStack analyzes repositories to recommend Open Source projects to support.,188,37,1533,1124,22,1838,2023-06-23T08:59:38Z,0,,,1,0,0,0
137038679,https://github.com/wmfs/statebox,statebox,Orchestrate workflows using Amazon States Language,42,6,514,1155,16,2301,2023-12-18T12:34:59Z,0,,,1,0,0,0
137249745,https://github.com/magento/pwa-studio,pwa-studio,"🛠Development tools to build, optimize and deploy Progressive Web Applications for Magento 2.",1039,671,4235,2532,177,2349,2024-05-07T10:13:42Z,0,,,19,0,12,0
137603258,https://github.com/slothpixel/core,core,Open source Hypixel data platform,52,26,781,1132,33,2135,2024-04-20T19:51:54Z,0,,,1,0,0,0
139505285,https://github.com/brendannee/noobgallery,noobgallery,A minimalistic photo gallery with images stored on Amazon S3 and just the features you want.,21,2,22,87,3,2136,2024-05-07T16:42:14Z,0,,,1,0,0,0
139540556,https://github.com/cockpit-project/cockpit-podman,cockpit-podman,Cockpit UI for podman containers,383,81,1719,1733,30,2526,2024-05-14T18:11:09Z,0,,,1,0,0,0
139854376,https://github.com/adobe/helix-cli,helix-cli,Command-line tools for developing with AEM,46,50,2331,3783,36,2168,2024-05-11T18:49:08Z,0,,,1,0,0,0
139920884,https://github.com/uwblueprint/dancefest-web,dancefest-web,Ontario Secondary School Dancefest’s (OSSDF) Judging and Adjudication Platform,7,0,305,496,26,1698,2023-03-01T04:30:59Z,0,,,1,0,0,0
140454351,https://github.com/Azure/kubernetes-hackfest,kubernetes-hackfest,Delivering modern cloud-native applications with open source technologies on Azure Kubernetes Service,325,536,392,852,48,1924,2023-10-16T21:05:47Z,0,,,15,0,0,0
140648475,https://github.com/jeremydaly/lambda-warmer,lambda-warmer,A module to optimize AWS Lambda function cold starts,521,55,66,78,13,1963,2023-11-25T16:50:03Z,0,,,1,0,0,0
140921176,https://github.com/larsvers/d3-hexgrid,d3-hexgrid,Regular hexagon tessellation with edge cover detection.,149,15,31,80,2,1946,2023-07-18T22:04:49Z,0,,,1,0,0,0
141143250,https://github.com/SvanBoxel/delete-merged-branch,delete-merged-branch,"No more manually deleting merged branches, this lovely app does it for you.",318,57,256,236,10,1652,2023-01-23T11:49:04Z,1,aws,serverless,1,0,0,0
141204456,https://github.com/tech-conferences/conference-data,conference-data,Conference data for www.confs.tech,253,156,6659,11438,147,2130,2024-05-15T14:35:39Z,0,,,1,0,0,0
141485084,https://github.com/logdna/logdna-cloudwatch,logdna-cloudwatch,AWS Lambda for logging from CloudWatch into LogDNA,10,19,39,95,8,2102,2024-04-19T15:27:37Z,0,,,1,0,0,0
141758577,https://github.com/mavropalias/Overclips,Overclips,"Highlight clips from r/Overwatch. Built on React, GraphQL, and DynamoDB.",5,0,77,84,3,1953,2023-11-24T13:27:06Z,0,,,1,0,0,0
142057981,https://github.com/tillhub/schemas,schemas,All Tillhub API OpenAPI 3 compatible JSON Schemas.,6,3,952,3585,34,2122,2024-05-14T20:22:16Z,0,firebase,firebase,1,0,0,0
142203027,https://github.com/UMAprotocol/protocol,protocol,UMA Protocol Running on Ethereum,352,169,4750,3503,49,2120,2024-05-09T09:36:45Z,0,,,19,0,0,0
142418724,https://github.com/Jeff-Tian/ass,ass,在线视频字幕文件（ASS）编辑器  Online video subtitle (ASS) editor,46,13,58,58,2,1860,2023-08-29T11:48:02Z,0,,,1,0,0,0
143042959,https://github.com/vmware/vmware-log-collectors-for-public-cloud,vmware-log-collectors-for-public-cloud,Log collectors that send logs in AWS CloudWatch and CloudTrail to VMware Log Intelligence.,10,22,87,179,12,2024,2024-02-14T14:30:21Z,8,aws;azure,azure_functions;azure_resource_manager;aws_cloudformation_and_sam,2,0,0,0
143699035,https://github.com/comicrelief/lambda-wrapper,lambda-wrapper,Lambda Wrapper for AWS NodeJS Projects,18,0,1203,371,11,2102,2024-05-08T12:57:35Z,0,,,1,0,0,0
144123719,https://github.com/unicode-org/jira-github-pr-check,jira-github-pr-check,Checks GitHub pull requests for valid and accepted Jira tickets. Used for ICU and CLDR,11,15,65,79,3,2028,2024-02-26T21:51:48Z,0,,,1,0,0,0
144602014,https://github.com/DataBiosphere/duos-ui,duos-ui,Broad Institute Data Use Oversight System,9,4,2588,1988,36,2017,2024-05-15T18:16:31Z,0,,,1,0,0,0
144792887,https://github.com/ghdna/athena-express,athena-express,Athena-Express can simplify executing SQL queries in Amazon Athena AND fetching cleaned-up JSON results in the same synchronous or asynchronous request - well suited for web applications.,178,69,98,142,11,1710,2023-04-21T12:52:12Z,0,,,1,0,0,0
145423620,https://github.com/csg-i/assetcompliancetracker,assetcompliancetracker,ACT ,10,9,73,136,7,1900,2023-11-02T07:18:31Z,0,,,0,0,0,0
145759560,https://github.com/Uclusion/uclusion_web_ui,uclusion_web_ui,Web UI V2,7,2,160,7846,9,2093,2024-05-15T20:10:24Z,0,,,1,0,0,0
145815610,https://github.com/RishikeshDarandale/website-deploy,website-deploy,"A simple utility to deploy a static website to [s3-bucket, lambda, ...]",6,1,773,342,4,1831,2023-08-28T09:16:49Z,0,,,1,0,1,0
146116598,https://github.com/jeremydaly/serverless-mysql,serverless-mysql,A module for managing MySQL connections at SERVERLESS scale,1192,84,158,81,15,2030,2024-03-16T15:52:35Z,0,,,1,0,0,0
146154384,https://github.com/purpleteam-labs/purpleteam,purpleteam,CLI component of OWASP PurpleTeam,111,15,127,371,2,2149,2023-12-13T04:43:10Z,0,,,1,0,0,0
146519196,https://github.com/MetaMask/Add-Token,Add-Token,A simple web3 dapp that allows suggesting a token to users of compatible wallets like MetaMask.,142,106,84,80,9,2017,2024-03-06T16:57:12Z,0,,,1,0,0,0
146858800,https://github.com/TimothyJones/github-cognito-openid-wrapper,github-cognito-openid-wrapper,Small shim that allows AWS Cognito to talk to github (by providing an OpenID wrapper around the Github API),302,91,129,283,14,1958,2024-01-08T09:16:50Z,5,aws,aws_cloudformation_and_sam,1,0,5,0
146981844,https://github.com/mwakerman/kanbanist,kanbanist,The Universal Kanban Board for Todoist ,199,34,149,116,11,1788,2023-09-17T03:00:47Z,0,,,1,0,0,0
147112892,https://github.com/webiny/docs.webiny.com,docs.webiny.com,Webiny documentation,28,75,675,2109,41,2076,2024-05-09T08:46:45Z,0,vercel,vercel,2,0,0,0
